<?xml version="1.0" encoding="UTF-8"?>
<dataroot xmlns:od="urn:schemas-microsoft-com:officedata" xmlns:xsi="http://www.w3.org/2001/XMLSchema-instance"  xsi:noNamespaceSchemaLocation="Levelling.xsd" generated="2015-12-02T13:55:03">
<Levelling>
<Level>1</Level>
<EXP>0</EXP>
<Abilities>7</Abilities>
<HP>45</HP>
<Mana>5</Mana>
<ManaRegen>1</ManaRegen>
</Levelling>
<Levelling>
<Level>2</Level>
<EXP>150</EXP>
<Abilities>3</Abilities>
<HP>55</HP>
<Mana>15</Mana>
<ManaRegen>1</ManaRegen>
</Levelling>
<Levelling>
<Level>3</Level>
<EXP>450</EXP>
<Abilities>9</Abilities>
<HP>65</HP>
<Mana>25</Mana>
<ManaRegen>1</ManaRegen>
</Levelling>
<Levelling>
<Level>4</Level>
<EXP>1000</EXP>
<Abilities>1</Abilities>
<HP>70</HP>
<Mana>30</Mana>
<ManaRegen>2</ManaRegen>
</Levelling>
<Levelling>
<Level>5</Level>
<EXP>2250</EXP>
<HP>80</HP>
<Mana>40</Mana>
<ManaRegen>2</ManaRegen>
</Levelling>
<Levelling>
<Level>6</Level>
<EXP>3500</EXP>
<Abilities>4</Abilities>
<HP>85</HP>
<Mana>45</Mana>
<ManaRegen>2</ManaRegen>
</Levelling>
<Levelling>
<Level>7</Level>
<EXP>5000</EXP>
<HP>95</HP>
<Mana>55</Mana>
<ManaRegen>3</ManaRegen>
</Levelling>
<Levelling>
<Level>8</Level>
<EXP>6500</EXP>
<Passives>(4,1)</Passives>
<HP>100</HP>
<Mana>65</Mana>
<ManaRegen>3</ManaRegen>
</Levelling>
<Levelling>
<Level>9</Level>
<EXP>8500</EXP>
<HP>110</HP>
<Mana>75</Mana>
<ManaRegen>3</ManaRegen>
</Levelling>
<Levelling>
<Level>10</Level>
<EXP>11000</EXP>
<HP>120</HP>
<Mana>85</Mana>
<ManaRegen>4</ManaRegen>
</Levelling>
</dataroot>
